Stock,Comment,Commented By,Timestamp
Deepak Nitrite,"deepak  nitrite  stock  has  broken  out  from  a  solid  base  that  was  established  between  rs  2,380-1,800  levels  over  the  past  year.  the  breakout,  accompanied  by  substantial  trading  volumes.  additionally,  the  macd  (moving  average  convergence  divergence)  indicator  has  experienced  a  positive  crossover  above  the  zero-line,  signaling  the  presence  of  positive  momentum  in  the  trend.  going  ahead  we  expect  the  prices  to  move  higher  till  the  mark  of  rs  2m720  where  the  stop-loss  must  be  rs  2,390  on  a  daily  closing  basis.",Deepak Nitrite,01-01-2025 09:50
Deepak Nitrite,people  wont  imagine  from  current  level  deepak  can  easily  reach  6300  level  in  2  year  time  frame.  do  not  sell  in  20-30  percent  return,Deepak Nitrite,01-01-2025 12:53
Deepak Nitrite,"Deepak  Nitrite  unit  Deepak  Chem  Tech  signs  MoU  worth  Rs  9,000  crore  with  Gujarat  Government.",Deepak Nitrite,01-02-2025 03:36
Deepak Nitrite,"the  companys  unit,  Deepak  Chem  Tech,  signed  a  Memorandum  of  Understanding  worth  Rs  9,000  crore  with  the  Gujarat  government.",Deepak Nitrite,01-02-2025 10:23
Deepak Nitrite,"Meghma  you  must  have  made  250  percent  profits  as  price  was  under  600  back  then  .  That  is  so  interesting  .  My  case  ,  have  been  holding  this  since  April  2021  ,  the  stock  keep  hovering  in  the  same  range  since  2  years  .",Deepak Nitrite,01-09-2024 05:17
Deepak Nitrite,RK0079..  Yes  it  is  in  consolidation  mode  since  2021  and  so  is  the  index..  2024  onwards  things  would  change  and  breakout  in  this  counter  would  surely  happen  with  the  launch  of  their  new  products,Deepak Nitrite,01-09-2024 06:08
Deepak Nitrite,"watch  out  deepak  nitrite,  price  n  volume  action  is  there  in  subdued  market  today.",Deepak Nitrite,01-10-2024 10:24
Deepak Nitrite,"mnm,  tvs  motor,  bajaj  auto  and  maruti  are  my  top  favourite  in  auto  sector  if  that  helps  to  invest  in  auto  sector.  i  am  available  if  you  have  any  questions.",Deepak Nitrite,01-10-2024 13:43
Deepak Nitrite,Sell  Sell  Target  1750  intact  ????,Deepak Nitrite,01-11-2024 14:28
Deepak Nitrite,"Deepak  Nitrite  is  on  the  verge  of  collapse,  its  going  to  fall  very  sharply  in  coming  days..",Deepak Nitrite,01-11-2024 17:39
Deepak Nitrite,DN  may  be  alarm  yesterday  above  2500  but  if  it  cross  again  2500  then  blind  buy  as  breakout  confirm  and  it  will  move  towards  3000  compay  have  aggressive  expansion  policy  announce  timely,Deepak Nitrite,02-01-2025 09:37
Deepak Nitrite,DN  may  be  alarm  yesterday  above  2500  but  if  it  cross  again  2500  then  blind  buy  as  breakout  confirm  and  it  will  move  towards  3000  compay  have  aggressive  expansion  policy  announce  timely,Deepak Nitrite,02-01-2025 09:37
Deepak Nitrite,DN  may  be  alarm  yesterday  above  2500  but  if  it  cross  again  2500  then  blind  buy  as  breakout  confirm  and  it  will  move  towards  3000  compay  have  aggressive  expansion  policy  announce  timely,Deepak Nitrite,02-01-2025 09:37
Deepak Nitrite,going  to  test  2458  then  up  side  movie,Deepak Nitrite,02-01-2025 10:59
Deepak Nitrite,look  for  2200  again  dont  worry  it  will  rally  upto  2200,Deepak Nitrite,02-07-2024 19:25
Deepak Nitrite,Deepak  Nitrate  cloud  has  reached  to    a  level  to  burst  anytime….  Not  the  GOd  but  can  tell  you  it  will  burst  soon.,Deepak Nitrite,02-08-2024 07:16
Deepak Nitrite,"Mo  multiplier  you  are  genius...
within  few  days  it  will  come  to  Rs  117...
I  will  sell  when  it  touches  Rs  100",Deepak Nitrite,02-08-2024 17:18
Deepak Nitrite,I  am  holding  Deepak  Nitrite  since  2021.  I  am  in  huge  loss.  Still  hoping  Deepak  Nitrite  rising  above  10K  before  2025.  Company  management  should  think  about  loyal  investors  and  declare  bonus  at  this  time  to  value  their  loyalty.  Else  investors  has  a  power  to  shut  down  any  company  if  company  behaves  arbitrarily.,Deepak Nitrite,02-09-2024 10:56
Deepak Nitrite,buy  deepak  nitrite  targat  prises  rs.  2040  2075  2105,Deepak Nitrite,02-11-2024 14:20
Deepak Nitrite,buy  now....2600  by  this  week  and  may  touch  3000  by  this  monthend...  result  month...  buy  buy,Deepak Nitrite,03-01-2025 08:15
Deepak Nitrite,Big  fall  today.  Deepakntr  isnt  worth  more  than  1950.,Deepak Nitrite,03-05-2024 07:48
Deepak Nitrite,i  am  really  disappointed.  seems  like  people  are  deliberately  not  letting  it  cross  2500  level.,Deepak Nitrite,03-05-2024 13:43
Deepak Nitrite,buy  at  current  rate  with  a  target  of  2449.,Deepak Nitrite,03-06-2024 09:35
Deepak Nitrite,tomorrow  it  will  definitely  cross  2720,Deepak Nitrite,03-07-2024 16:20
Deepak Nitrite,"The  Centre  will  soon  come  up  with  a  Production-Linked  Incentive  (PLI)  scheme  for  basic  chemicals  for  the  promotion  of  the  overall  chemical  sector,  Union  minister  Mansukh  Mandaviya  said  here  on  Saturday.  Mandaviya  also  said  that  his  ministry  has  been  working  on  an  international-standard  drugs  and  cosmetic  bill  which  will  be  introduced  in  the  Cabinet  in  a  months  time  before  being  passed  in  Parliament.  He  was  addressing  members  of  the  Southern  Gujarat  Chamber  of  Commerce  and  Industry.",Deepak Nitrite,03-09-2024 22:30
Deepak Nitrite,"????perfectly  cup  &  handle  formation  on  charts...shortly  it  will  start  its  continuous  uptread  ..only  its  need  lilttle  patience,????????",Deepak Nitrite,03-10-2024 07:36
Deepak Nitrite,"handle  is  coming  down,  cup  has  broken  .and  fallen  on  floor",Deepak Nitrite,03-10-2024 09:12
Deepak Nitrite,why  the  sudden  fall  today,Deepak Nitrite,03-12-2024 13:02
Deepak Nitrite,Fabulous..  You  are  confused  because  you  are  suffering  from  serious  delusion..  Dont  worry  your  problem  can  be  solved  just  with  an  appointment  with  a  psychiatrist...,Deepak Nitrite,03-12-2024 13:17
Deepak Nitrite,I  think  profit  Booking,Deepak Nitrite,03-12-2024 14:26
Deepak Nitrite,Any  authentic  news  for  the  fall,Deepak Nitrite,03-12-2024 14:40
Deepak Nitrite,deepak  changed  dealer   needs  300  cr  fund  .,Deepak Nitrite,03-12-2024 17:21
Deepak Nitrite,Today  Delivery  percentage  is  50.8,Deepak Nitrite,03-12-2024 20:30
Deepak Nitrite,"Motilal  Oswal  Midcap  30  Fund  sold  7.6  lakh  shares  0.56  percent  stake  of  Deepak  Nitrite  Ltd  at  Rs  2,653.22  per  share  via  a  bulk  deal  on  December  3.",Deepak Nitrite,03-12-2024 21:09
Deepak Nitrite,Who  purchase  this  institution  or  promotor,Deepak Nitrite,03-12-2024 22:17
Deepak Nitrite,Q3  numbers  to  coming  in  february,Deepak Nitrite,04-01-2025 07:26
Deepak Nitrite,vag  deepak  vag  2540  onboard  buy  only  buy  good  move,Deepak Nitrite,04-01-2025 10:49
Deepak Nitrite,Deepak  Nitrite  is  surely  buy  buy  buy  very  soon  2536,Deepak Nitrite,04-01-2025 11:12
Deepak Nitrite,"Target  price  of  R  2800  by  February,  2024.  Deepak  Nitrite  has  increased  rates  of  IPA",Deepak Nitrite,04-01-2025 12:49
Deepak Nitrite,Ready  to  fly  at  any  point  of  time.  Dont  loose  patience.,Deepak Nitrite,04-02-2025 15:10
Deepak Nitrite,dont  repeat  your  message,Deepak Nitrite,04-03-2025 23:22
Deepak Nitrite,Purchase  DEEPAKNTR  at  2188  with  a  target  set  at  2209-2245  and  a  stop-loss  at  2160    for  intraday  trading.,Deepak Nitrite,04-04-2024 09:51
Deepak Nitrite,itnay  Mehnegay  mein  kaun  buy  kar  rha  hai  bhai  itna  paisa  kahan  se  latay  hain  log,Deepak Nitrite,04-07-2024 11:33
Deepak Nitrite,"achieved    -3000  target  hold  it  investors  stock  for  long  term  ,  enjoy  investing  not  for  traders  and  operator.  others  pl  exit  the  forum  as  they  will  be  sad  once  it  is  3000  missing  feelings

next  target  is  3500  this  year  
4000  next  year  
10000  long  term
only  for  investors  with  stable  mind  set",Deepak Nitrite,04-08-2024 22:34
Deepak Nitrite,buy  deepaknntr  moved  above  20  dma  and  is  looking  very  strong,Deepak Nitrite,04-09-2024 09:39
Deepak Nitrite,"Deepak  Nitrite  all  salling  products  average  25%  UP,  65  DAYS",Deepak Nitrite,04-09-2024 11:19
Deepak Nitrite,its  moving  up  in  falling  market  it  can  move  4-5  percent  easily,Deepak Nitrite,04-09-2024 11:48
Deepak Nitrite,its  just  fake  upmove  global  market  are  also  seeing  slowdown  .....  usa  is  falling  and  phenol  is  not  rising  sell  for  2000  level  s,Deepak Nitrite,04-09-2024 11:55
Deepak Nitrite,deepak  ntr  is  70  rupees  above  yesterday  close  for  now  reason   rejected  increase  in  anti  dumping  duties  for  chemicals  but  still  operator  is  creating  fomo  it  should  be  down  100  rupees  today  instead  of  rising,Deepak Nitrite,04-09-2024 13:01
Deepak Nitrite,go  short  srf  instead  of  deepak  ntr  .....chemicals  are  weak,Deepak Nitrite,04-09-2024 13:02
Deepak Nitrite,short  deepak  baba  for  2960  levels  now  very  weak  ....technical  its  a  sell  for  today,Deepak Nitrite,04-09-2024 13:40
Deepak Nitrite,hard  core  bulls  should  sell  only  below  2800   for  few  days  this  fake  spike  will  be  sold  into,Deepak Nitrite,04-09-2024 15:05
Deepak Nitrite,lag  gayi  lanka  market  depth  mein  35000  buyers  aur  70000  sellers  there  is  2  sellers  for  every  buyer,Deepak Nitrite,04-09-2024 15:12
Deepak Nitrite,Morgan  Stanley  gave  target  of  3300.....,Deepak Nitrite,04-09-2024 17:04
Deepak Nitrite,who  will  buy  for  3300  Morgan  Stanley  or  retailers    ...  1000  crore  ki  buying  to  deepak  ntr  ko  hi  chahiye  hogi,Deepak Nitrite,04-09-2024 22:58
Deepak Nitrite,back  to  the  same  price  again  ..  kitna  aur  add  kare..  this  looks  difficult  crossing  2500  in  the  near  future..,Deepak Nitrite,04-10-2024 16:44
Deepak Nitrite,future  lover  Be  ready  for  trades  everyday  with  the  most  accuratte  Cals  Daily  Basis  Just  Texxct  On  Vhatsap  eight  Double  4549  Tw0  O56….,Deepak Nitrite,04-10-2024 16:46
Deepak Nitrite,"The  board  of  directors  of  Deepak  Nitrite  at  their  meeting  held  October  4,  2023  have  approved  incorporation  of  new  wholly  owned  subsidiary  of  the  company  and  investment  up  to  Rs  5  Crores  in  the  Equity  Capital  of  proposed  WOS,  from  time  to  time,  in  one  or  more  tranches.  The  proposed  WOS  shall  engage  in  the  business  of  providing  Project  Engineering,  Procurement,  Construction,  Commissioning,  Management  and  Consultancy  services.",Deepak Nitrite,04-10-2024 16:59
Deepak Nitrite,"Nitrite  is  coming  out,    Its  going  to  ICU",Deepak Nitrite,04-10-2024 18:35
Deepak Nitrite,"Deepak  Nitrite  is  on  the  verge  of  collapse,  its  going  to  fall  very  sharply  in  coming  days..  View  more",Deepak Nitrite,04-11-2024 17:19
Deepak Nitrite,"DEEPAK  PMC  LIMITED  (%u2018DPMCL%u2019)  has  been  incorporated  on  2nd  December,  2023  as  a  wholly  owned  subsidiary  of  the  Company.  The  Authorised  and  Paid-up  Equity  Share  Capital  of  DPMCL  shall  be  %u20B9  5  Crores.  DPMCL  shall  engage  in  the  business  of  inter  alia  providing  Project  Engineering,  Procurement,  Construction,  Commissioning,  Management  and  Consultancy  services.",Deepak Nitrite,04-12-2024 11:59
Deepak Nitrite,immediately  book  full  profit  and  exit  for  lower  tgt  is  below  2630rs,Deepak Nitrite,04-12-2024 12:06
Deepak Nitrite,????I  am  not  judging  how  big  failure  u  r  ....  parle  g  bhi  mehenga  hogaya  2  saal  mein  ye  share  parle  g  ko  bhi  beat  nhi  kar  pa  rha  hai,Deepak Nitrite,04-12-2024 12:54
Deepak Nitrite,something  big  is  coming  in  this  counter  fasten  ur  seat  belts.  last  time  at  this  rate,Deepak Nitrite,05-01-2025 15:12
Deepak Nitrite,"3000  target  hold  it  investors  stock  for  long  term  ,  enjoy  investing  not  for  traders  and  operator.  others  pl  exit  the  forum  as  they  will  be  sad  once  it  is  3000  missing  feelings",Deepak Nitrite,05-04-2024 12:19
Deepak Nitrite,"cautious  for  this  stock,  monsoon  will  come  ????",Deepak Nitrite,05-06-2024 22:40
Deepak Nitrite,"please  share  the  latest  updates  about  the  q1  results,  revenue  np  and  EPS  etc",Deepak Nitrite,05-08-2024 18:37
Deepak Nitrite,Result  unload  bse  web  site.,Deepak Nitrite,05-08-2024 19:38
Deepak Nitrite,Deepak  Nitrite  Q1  Results  Profit  Rises  35,Deepak Nitrite,05-08-2024 20:14
Deepak Nitrite,Results  are  not  bad  but  global  factors  coupled  with  geo  political  tensions  will  bring  the  price  down  by  at  least  10  percent  from  current  level,Deepak Nitrite,05-08-2024 20:35
Deepak Nitrite,"Results  are  good,  revenue  beats  Bloomberg  estimates  by  38cr  while  PAT  misses  estimates  by  7-8  cr",Deepak Nitrite,05-08-2024 20:48
Deepak Nitrite,no  signs  of  recovery  in  phenol  and  other  chemicals  so  just  liquidity  rush  it  might  be,Deepak Nitrite,05-08-2024 23:08
Deepak Nitrite,technically  its  a  sell  at  these  levels  look  2950     break  downsoon,Deepak Nitrite,05-09-2024 09:31
Deepak Nitrite,kisiko  is  stock  ma  half  blocked  and  half  allocated  stock  Aisa  dikha  Raha  hai?  iska  matlab  kya?,Deepak Nitrite,05-09-2024 09:49
Deepak Nitrite,ismein  400-500  crore  ki  supply  aayegi    itna  operator  aur  morgan  stanley  dono  nhi  buy  kar  payeingat,Deepak Nitrite,05-09-2024 10:32
Deepak Nitrite,there  is  2  sellers  for  every  buyer  in  market  depth  it  should  fall  10  percent  soon,Deepak Nitrite,05-09-2024 12:45
Deepak Nitrite,buy  calls  and  go  long  or  write  puts  then  only  it  will  go  below  2800,Deepak Nitrite,05-09-2024 13:11
Deepak Nitrite,its  down  10  rupees  now  buy  the  dip  add  more  longs  buy  more  calls,Deepak Nitrite,05-09-2024 14:27
Deepak Nitrite,buy  3000  strike  call  option  its  very  cheap,Deepak Nitrite,05-09-2024 14:31
Deepak Nitrite,market  cannot  go  down  its  very  difficult  to  take  market  down   is  no  panic  keep  adding  lots  on  long  side,Deepak Nitrite,05-09-2024 14:54
Deepak Nitrite,"Shares  of  the  chemicals  manufacturer  are  up  by  1.1%.  This  came  after  the  company  announced  its  entry  into  the  project  engineering,  procurement,  construction,  commissioning,  management  and  consultancy  services  through  a  wholly  owned  subsidiary.",Deepak Nitrite,05-10-2024 12:41
Deepak Nitrite,Deepak  Nitrite  rises  on  new  venture  Deepak  Nitrite  rises  on  new  venture,Deepak Nitrite,05-10-2024 12:42
Deepak Nitrite,selling  pressure  and  more  downside  to  be  seen  -  My  target  for  Deepak  Nitrite  is  Rs  2100  for  the  intraday  with  a  stoploss  of  Rs  2230,Deepak Nitrite,05-12-2024 09:39
Deepak Nitrite,"Deepak  nitrate  is  a  sell  in  cash  market  with  strict  stop  loss,  dont  be  confused,  all  our  calls  are  in  strict  cash  market.",Deepak Nitrite,05-12-2024 09:50
Deepak Nitrite,"Deepak  nitrate  is  a  sell  in  cash  market  with  strict  stop  loss,  dont  be  confused,  all  our  calls  are  in  strict  cash  market.",Deepak Nitrite,05-12-2024 09:50
Deepak Nitrite,"Cash  market  sell  are  less  risky,  so  would  suggest  to  trade  in  cash  market  all  the  time.  keep  a  close  watch  for  downside.",Deepak Nitrite,05-12-2024 10:09
Deepak Nitrite,"Cash  market  sell  are  less  risky,  so  would  suggest  to  trade  in  cash  market  all  the  time.  keep  a  close  watch  for  downside.",Deepak Nitrite,05-12-2024 10:09
Deepak Nitrite,"giving  up  gains  and  turning  weak,  may  close  at  low  point  -  My  target  for  Deepak  Nitrite  is  Rs  2100  for  the  intraday  with  a  stoploss  of  Rs  2240",Deepak Nitrite,05-12-2024 10:50
Deepak Nitrite,"Deepak  ntr  below  2420  can  trigger  more  selling  pressure,  keep  selling  with  stop  loss  in  cash  market,",Deepak Nitrite,05-12-2024 11:30
Deepak Nitrite,"Deepak  ntr  below  2420  can  trigger  more  selling  pressure,  keep  selling  with  stop  loss  in  cash  market,",Deepak Nitrite,05-12-2024 11:30
Deepak Nitrite,Tomorrow  open  with  5%  above  2300,Deepak Nitrite,05-12-2024 15:40
Deepak Nitrite,why  ???????????????????????????,Deepak Nitrite,05-12-2024 22:30
Deepak Nitrite,is   you  elaborate,Deepak Nitrite,06-01-2025 19:19
Deepak Nitrite,buy  above  2260  levels  tgt  2280/2300  intraday,Deepak Nitrite,06-02-2025 12:45
Deepak Nitrite,SOME  SPECIAL  NEWS  IS  VERY  SOON...MADE  NEW  52  WEEK  HIGH..FANTASTIC  RESULTS  VERYSOON..  WATCH  &  BUY  FOR  2600/__  &  ABOVE....,Deepak Nitrite,06-05-2024 09:42
Deepak Nitrite,I  dont.  think  its  profit  can  increase  its  just  inflating  it  books  and  profit,Deepak Nitrite,06-05-2024 09:52
Deepak Nitrite,increasing  revenue  is  easy  u  just  have  to  create  fre  bogus  orders  but  increasing  profits  are  difficult,Deepak Nitrite,06-05-2024 10:20
Deepak Nitrite,Well  well  well....Much  awaited  move  with  good  volumes.,Deepak Nitrite,06-05-2024 11:02
Deepak Nitrite,"deepak  nitrite  surges  4%  to  hit  fresh  high  on  double  upgrade  from  morgan  stanley  shares  of  deepak  nitrite  surged  nearly  4  percent  after  morgan  stanley  double-upgraded  the  stock  to  ""overweight""  from  its  earlier  rating  of  ""underweight.""  the  international  brokerage,  also  raised  the  target  price  on  the  specialty  chemicals  stock  to  2,985,  implying  a  22  percent  upside  from  the  previous  closing  price.",Deepak Nitrite,06-05-2024 12:41
Deepak Nitrite,"deepak  nitrite  stock  surges  7%  to  hit  fresh  high  on  double  upgrade  from  morgan  stanley  recognising  industry-leading  metrics  and  top-quartile  returns,  morgan  stanley  anticipates  deepak  nitrite  to  outperform  further  as  new  investments  yield  results  and  earnings  improve.  morgan  stanley  expects  deepak  nitrite  to  double  its  base  earnings  by  2028,  backed  by  the  companys  push  to  become  an  integrated,  downstream  phenolics  producer.",Deepak Nitrite,06-05-2024 12:57
Deepak Nitrite,dn  has  chances  of  crossing  4000  this  year  .  already  entered  in  wave  5,Deepak Nitrite,06-05-2024 16:23
Deepak Nitrite,"remember  few  names  from  this  forum  like  tiwary  ,  penguin  ,  vishwa  ,  meghna  all  must  have  sold  this  scrip",Deepak Nitrite,06-05-2024 16:26
Deepak Nitrite,"shares  of  deepak  nitrite  surged  4  percent  after  global  brokerage  morgan  stanley  double-upgraded  the  stock  to  ""overweight""  from  its  earlier  rating  of  ""underweight.""  the  brokerage  also  raised  the  target  price  on  the  specialty  chemicals  stock  to  rs  2,985,  implying  a  22  percent  upside  from  the  previous  closing  price.  the  price  target  has  been  raised  to  reflect  a  higher  multiple  for  the  base  business  and  a  higher  medium-term  capex.",Deepak Nitrite,06-05-2024 17:18
Deepak Nitrite,huge  fall  will  eat  away  all  gains  made  today,Deepak Nitrite,06-05-2024 18:54
Deepak Nitrite,very  soon  2990  touch  deepak  nitrate  tightly  hold  this....,Deepak Nitrite,06-07-2024 01:31
Deepak Nitrite,"deepak  nitrite  has  been  showing  some  strength  recently,  consolidating  near  the  neckline  and  important  resistance  level  of  rs  2,650.  if  the  strength  continues  and  surpasses  the  rs  2,650  level,  a  rally  towards  the  rs  2,800  level  would  be  possible  in  the  near  term.  above  rs  2,800,  the  stock  can  surge  towards  its  all-time  high  level  of  rs  3,000.",Deepak Nitrite,06-07-2024 15:17
Deepak Nitrite,definitely  deepak  nitrate  may  cross  2800  level,Deepak Nitrite,06-07-2024 16:25
Deepak Nitrite,supply  has  started  it  will  soon  be  below  2900   Sako  to  bacha  lo  capital,Deepak Nitrite,06-09-2024 10:19
Deepak Nitrite,2  sellers  for  every  buyers  again  for  today  keep  buying  calls  option  today  also,Deepak Nitrite,06-09-2024 11:03
Deepak Nitrite,buy  calls  and  long  futures  near  2935  which  is  todays  low    its  only  2  hours  more  selling  will  come  dont  worry,Deepak Nitrite,06-09-2024 11:15
Deepak Nitrite,Haan  lag  rha  hai  yahan  koi  fund  buying  active  hai,Deepak Nitrite,06-09-2024 11:22
Deepak Nitrite,Aaj  operator  bhi  delivery  buying  nhi  karega  itni  jyaada  kyunki  market  is  seeing  crash  like  selling,Deepak Nitrite,06-09-2024 12:54
Deepak Nitrite,go  short  at  current  price   targets  of  2920   buy  for  few  days  its  broken  trend  after  many  days,Deepak Nitrite,06-09-2024 13:01
Deepak Nitrite,deepak  baba  bhi  kitna  hi  operate  karengay  Aaj  pura  market  hil  gya  hai,Deepak Nitrite,06-09-2024 13:03
Deepak Nitrite,"deepak  nit  stock  may  be  touch  low  level  2100  RSI,  MACD  ,  Stochastic,EMA  indicators  shows  down  trend..",Deepak Nitrite,06-09-2024 23:38
Deepak Nitrite,tomorrow  dn  numbers  .  profit  after  tax  175  crores  or  more,Deepak Nitrite,06-11-2024 10:01
Deepak Nitrite,Somebody  has  the  inside  news  about  the  results.  Stock  going  up  like  crazy  before  results,Deepak Nitrite,06-11-2024 12:17
Deepak Nitrite,May  announce  bonus  shares....,Deepak Nitrite,06-11-2024 16:33
Deepak Nitrite,"anu  news  about  bonus,",Deepak Nitrite,06-11-2024 16:51
Deepak Nitrite,can  you  plz  tell  me  the  time  of  result..  PAT  175  cr  means  it  postive  or  neg,Deepak Nitrite,06-11-2024 23:21
Deepak Nitrite,Midcaps  and  large  caps  will  soon  begin  to  move,Deepak Nitrite,06-12-2024 06:59
Deepak Nitrite,HOLD  deepak  ntr  for  5  digits,Deepak Nitrite,06-12-2024 06:59
Deepak Nitrite,"Agro  chemicals  is  again  in  focus,  Deepak  nitrite  is  at  lower  point  buy  from  here  for  tgt  2300  for  today",Deepak Nitrite,06-12-2024 14:06
Deepak Nitrite,"morgan  stanley  upgraded  the  stock  to  overweight  and  raised  the  target  price  to  rs  2,985.  bull  argument:  company%u2019s  new  investment  cycle  of  over  $1  billion,  its  largest  till  date,  will  drive  the  next  leg  of  rerating  for  the  stock,  says  morgan  stanley.  base  earnings  could  double  by  2028,  the  aim  is  to  become  an  integrated,  downstream  phenolics  producer.  bear  argument:  gross  profit  margins  unlikely  to  return  to  the  levels  seen  between  fy20  and  fy22.  that  means  revenues  need  to  grow  in  a  big  way  to  be  able  to  sustain  premium  valuation.",Deepak Nitrite,07-05-2024 09:45
Deepak Nitrite,very  positive  stock  2200  will  happen  here  soon,Deepak Nitrite,07-05-2024 11:22
Deepak Nitrite,bhai  tu  Zinda  hai  abhi  tak,Deepak Nitrite,07-05-2024 18:12
Deepak Nitrite,Go  to  Mirea  s  m.stocks.,Deepak Nitrite,07-08-2024 10:36
Deepak Nitrite,try  m.stocks  .  It  is  zero  brokerage  platform  subject  to  payment  one  time  payment  of  Rs.  999.,Deepak Nitrite,07-08-2024 10:39
Deepak Nitrite,koi  fark  nhi  pdta  crude  oil  bdhega  toa  china  dump  nhi  krega  chemical  share  new  high  ki  taraf  hai,Deepak Nitrite,07-09-2024 10:33
Deepak Nitrite,"start  buying  very  good  news  is  coming  in  DN  stock,may  be  bonus  and  split",Deepak Nitrite,07-09-2024 13:40
Deepak Nitrite,"do  not  speculate  in  investing  stock  like    DN  ,  IT  IS  GOING  TO  BE  3000  in  coming  time  hold  and  add  ,  and  be  rich  with  mind  not  buy  just  luck",Deepak Nitrite,07-11-2024 10:10
Deepak Nitrite,result  is  positive.  thats  going  up,Deepak Nitrite,07-11-2024 10:14
Deepak Nitrite,By  chance  if  profits  fall  under  150  crores  then  again  bad  days  would  continue  .,Deepak Nitrite,07-11-2024 10:15
Deepak Nitrite,"DNL  July,August,Saptember  This  months  DNL  manufacturing  products  price  go  to  upto  45%  Avrage",Deepak Nitrite,07-11-2024 11:16
Deepak Nitrite,thats  great  ????  but  watz  ur  thought  it  will  be  going  down?  or  it  will  be  break  2500  level!!,Deepak Nitrite,07-11-2024 12:44
Deepak Nitrite,so  what  is  the  impact?  going  up?,Deepak Nitrite,07-11-2024 14:17
Deepak Nitrite,if  margine  goes   will  be  hammered  5-8  %...............,Deepak Nitrite,07-11-2024 14:48
Deepak Nitrite,last  quarter  I  hope  it  not  be  bcos..  Israel  conflict  highly  bromine  demand  in  global..  DNL  production  25%  on  it,Deepak Nitrite,07-11-2024 15:36
Deepak Nitrite,Is  the  result  out?  I  see  net  profit  after  taxes  to  be  of  Rs.174.47  Cr  on  Livemint.  Is  it  correct?,Deepak Nitrite,07-11-2024 18:54
Deepak Nitrite,"great  results,  EBIDTA  Margins  at  17%  looks  extremely  awsum....  will  eventually  fly  to  2300  from  here....  management  commentary  important...  future  timelines  of  commissioning  of  new  projects  needs  to  be  looked  at....",Deepak Nitrite,07-11-2024 19:10
Deepak Nitrite,Posted  net  profit  more  than  200  crores.  may  be  tomorrow  UC  chances.,Deepak Nitrite,07-11-2024 19:16
Deepak Nitrite,"#Q2WithETNOW  |  Deepak  Nitrite  cons  PAT  at  Rs.205.1  cr  vs  Rs.174.5  cr,  up  17.5%  YoY",Deepak Nitrite,07-11-2024 19:16
Deepak Nitrite,"PAT  up  17.5%  YoY  with  margin  expansion,  awesome  no.  posted  by  DN",Deepak Nitrite,07-11-2024 19:18
Deepak Nitrite,Bumper  results  posted  by  DN.  It  will  cross  2500  in  the  coming  quarter.,Deepak Nitrite,07-11-2024 19:27
Deepak Nitrite,cant  say  something  now.  No  improvement  in  revenue.  standalone  revenue  reduced  from  last  quarter  and  consolidated  revenue  also  less  YoY.  Only  improvement  in  PAT.  But  after  a  long  time  little  positive  also  matters  a  lot.  I  feel  the  journey  will  start  from  tomorrow.  all  the  best.,Deepak Nitrite,07-11-2024 19:45
Deepak Nitrite,tomorrow  may  be  uc  in  dipak  nitrite,Deepak Nitrite,07-11-2024 19:50
